{
  "schema": "cgo.knowledge-map.manifest.v1",
  "kind": "knowledge_map",
  "id": "official.sample-math",
  "legacy_ids": [
    "sample.curriculum"
  ],
  "title": "Sample Math Knowledge",
  "description": "Small fixture for knowledge-map manifest validation.",
  "version": "0.1.0",
  "language": "zh-CN",
  "curriculum": "sample.curriculum",
  "owner": {
    "type": "official",
    "name": "CathyGO"
  },
  "visibility": "public",
  "source_type": "curriculum_standard",
  "assets": {
    "group_map": {
      "path": "assets/knowledge-group-map-data.json",
      "bytes": 123,
      "sha256": "e3b0c44298fc1c149afbf4c8996fb92427ae41e4649b934ca495991b7852b855"
    }
  },
  "task_links": {
    "learning_paths": [],
    "diagnostics": [],
    "practice_sets": [],
    "projects": []
  },
  "overlays": {
    "user_progress": [],
    "user_notes": [],
    "custom_edges": []
  },
  "generated_at": "2026-06-28T00:00:00Z"
}

